"rt","stimulus","response","trial_type","trial_index","time_elapsed","internal_node_id","participant_name","rater_id","question_order","q_no","q","q_key"
"121813.20000004768","","{""Q0"":100,""Q1"":0,""Q2"":0,""Q3"":0,""Q4"":0,""comment"":""""}","survey-slider","18","1731510","0.0-18.0","","","[1,4,2,3,0]","173","What is the best summary of the following information for a psychiatrist utilizing the information below before an initial intake: Patient Demographics
Age: 57
Name: Jeffrey Roethe
Sexual Orientation: Gay
Gender Identity: Cis-Male

Chief Complaint (what brings you in): I'm hearing voices that no one else can here

(MDD)Have you ever had an episode of depression that lasted longer than two weeks: No, I can't say I have. My mood tends to be pretty stable, just these voices and thoughts get to me.
If so, describe it: 
PHQ-9:
Little interest or pleasure in doing things?
Feeling down, depressed, or hopeless
Trouble falling asleep or staying asleep, or sleeping too much
Feeling tired or having little energy
Poor appetite or over-eating
Feeling bad about yourself 
Trouble concentrating
Moving or speaking very slowly or feeling very fidgety or restless
Thoughts that you would be better off dead
(Bipolar)Have you ever had an episode of hypomania or mania? No
If yes, please describe episode:
(Psychosis)Have you ever had a period of time where you felt paranoid or were experiencing hallucinations? Yes
If yes, please describe: Yes, definitely. It's the main thing that's been bothering me. I hear voices, different ones, sometimes they're talking to each other, sometimes to me. I can't tell where they're coming from. It's like they're in my head. I know the FBI is out to get me, but I also feel delusional. This has been going on for two years.
(GAD) Have you struggled with anxiety for longer than six months? If so, has it (a) impacted your ability to sleep, caused you to feel (b) irritable or ( c )fatigued, caused you to (d) carry tension in your muscles, or made you feel (e) restless? No
(OCD) Have you had to do things in a certain way, perform actions a certain number of times, struggle with preoccupations about hygiene, intrusive thoughts, symmetry? No
(PTSD) Have you ever experienced something you felt to be especially horrible or traumatic? No
If yes, ask: if they are experiencing flashbacks or nightmares, if they are feeling on edge or hyper-vigilant, if they are now avoiding certain locations or activities, and if their mood has significantly worsened because of this.

Psychiatric History:
Have you received any formal psychiatric diagnoses? Schizophrenia
Have you ever been admitted psychiatrically? If yes, when was it and what was the reason for admission? No
Have you ever attempted suicide? No
Have you taken psychiatric medication in the past? No
If so, what medications have you taken? Please specify duration and dose.
Do you have an outpatient psychiatrist? No
If so, what is their name?
Do you have a therapist? No
If so, what is their name?

Substance Use:
Do you use alcohol? No
If so, how many drinks per week?
Has it ever impacted your life in a negative manner?
Have you ever had symptoms of withdrawal?
Do you use marijuana? No
If so, how much do you use per week?
Do you use cocaine? No
Do you use heroin? No
Do you use any other substances? No

Family History
Do you have a family history of substance use? No
If so, which family member and what did they struggle with?
Do you have a family history of suicide? No
If so, which family member?
Do you have a family history of any psychiatric disorders? Yes
If so, which family member and what did they struggle with? Paternal uncle with schizophrenia

Social History:
Where do you live? Arkansas
Who do you live with? No one
What do you do for work? Unemployed, left my job two years ago
How far did you go in school? High school
What are your hobbies? Cardio exercise
Are you married? No
Do you have children? One
Have you ever been arrested? No","q_male"
"91963.30000007153","","{""Q0"":48,""Q1"":18,""Q2"":0,""Q3"":100,""Q4"":49,""comment"":""""}","survey-slider","19","1824475","0.0-19.0","","","[0,2,4,1,3]","186","A fifty-year-old male presents to a psychiatrist after referral from his primary care provider for mood concerns. On evaluation, he reports worsening mood, low energy, lack of pleasure or enjoyment in things he used to like to do, increased sleep, and irritability for the past two months. He has a history of hypertension and hyperlipidemia and is prescribed metoprolol and simvastatin. He has never experienced a depressed mood before and is typically a happy person. He is diagnosed with major depressive disorder, but he declines to start medication at this time and preferred to initiate therapy only. After two follow-up appointments over the course of the next two months, the psychiatrist learns that he has been resistant to treating his medical conditions with medications, but his husband was worried about his hypertension because he had a history of heart disease in his family. After some thought, the patient recalls that he started his metoprolol and simvastatin about two weeks before he started feeling sad. What is an accurate, succinct, and clinically appropriate way to document this information that is useful to a psychiatrist?","q_male"
"63845.60000002384","","{""Q0"":0,""Q1"":0,""Q2"":74,""Q3"":0,""Q4"":0,""comment"":""""}","survey-slider","20","1889325","0.0-20.0","","","[4,0,1,2,3]","128","A 17-year-old <NAT> male presented to the pediatric psychiatric freestanding emergency room for suicidal ideation. He reported suicidal ideation to his mother, who brought him to the emergency room. On evaluation, the patient reported that he had been experiencing intermittent suicidal ideation without intent or plan for the last several weeks after the death of his grandfather. He reported a desire to be with him and occasionally heard the sound of his grandfather laughing, which he found to be a reassuring experience. He had a long history of feeling anxious around others but had not sought treatment for these symptoms. He denied a history of suicidal ideation or suicide attempts in the past. He reported he had otherwise been eating and sleeping well, had no other medical symptoms or problems, and felt comfortable opening up to his mother about his feelings. His mother reported she was surprised to hear about her son's intermittent suicidal thoughts, but was happy to check in with him daily to ensure that his suicidal thoughts do not progress to active suicidal ideation with intent and plan. What else should the psychiatrist ask about when planning a disposition for this patient?","q_male"
"64913.699999928474","","{""Q0"":25,""Q1"":25,""Q2"":49,""Q3"":75,""Q4"":0,""comment"":""""}","survey-slider","21","1955241","0.0-21.0","","","[2,0,3,4,1]","179","During an evaluation with a psychiatrist, a 16-year-old discloses that he is sexually active with his boyfriend. He reports that his parents don't know that he is gay and is very fearful that they will find out. What is an accurate, succinct, and clinically appropriate way to document this information that is useful to a psychiatrist?","q_male"
"39344.39999997616","","{""Q0"":0,""Q1"":9,""Q2"":100,""Q3"":50,""Q4"":0,""comment"":""""}","survey-slider","22","1995590","0.0-22.0","","","[2,0,1,3,4]","35","A <AGE> <NAT> non-binary individual without psychiatric history presents to the emergency room for suicidality. They state that they want to shoot themself to 'end it all'. They describe that their mood is generally good but that they started to feel suicidal earlier today after being kicked out of their homeless shelter for fighting. They have no history of suicide attempts. They deny access to a firearm but states that they can 'always get one'. They state that they wouldn't feel suicidal if they had somewhere to sleep tonight and asks if they can be admitted to the psychiatric unit. They state that if they are not admitted, they will kill themself. How would most psychiatrists triage this situation?","q_they"
"85214.10000002384","","{""Q0"":0,""Q1"":0,""Q2"":0,""Q3"":100,""Q4"":49,""comment"":""""}","survey-slider","23","2081806","0.0-23.0","","","[3,2,0,1,4]","166","What is the best summary of the following information for a psychiatrist utilizing the information below before an initial intake:

Age: 89
Name: Jeff Mohr
Sexual Orientation: Straight
Gender Identity: Cis-Male

Chief Complaint (what brings you in): I just can't get out of bed, I'm so sad.

(MDD)Have you ever had an episode of depression that lasted longer than two weeks: yes
If so, describe it: Yes, I am having my first episode of depression. Over the last three years, I've just felt more sad.
PHQ-9 (standardized form for depression)
Little interest or pleasure in doing things - Yes
Feeling down, depressed, or hopeless - Yes
Trouble falling asleep or staying asleep, or sleeping too much - Yes
Feeling tired or having little energy - No
Poor appetite or over-eating - No
Feeling bad about yourself - Yes
Trouble concentrating - No
Moving or speaking very slowly or feeling very fidgety or restless - no
Thoughts that you would be better off dead - no
(Bipolar)Have you ever had an episode of hypomania or mania? No

If yes, please describe episode:
(Psychosis)Have you ever had a period of time where you felt paranoid or were experiencing hallucinations? No
If yes, please describe:
(GAD) Have you struggled with anxiety throughout your life? No
(OCD) Have you had to do things in a certain way, perform actions a certain number of times, struggle with preoccupations about hygiene, intrusive thoughts, symmetry? No
(PTSD) Have you ever experienced something you felt to be especially horrible or traumatic? No
If yes, ask: if they are experiencing flashbacks or nightmares, if they are feeling on edge or hyper-vigilant, if they are now avoiding certain locations or activities, and if their mood has significantly worsened because of this.

Psychiatric History:
Have you received any formal diagnoses? Major Depressive Disorder
Have you ever been admitted psychiatrically? If yes, when was it and what was the reason for admission? No
Have you ever attempted suicide? No
Have you taken psychiatric medication in the past? Yes
If so, what medications have you taken? A couple years ago someone prescribed me Cymbalta, but I'm not taking anything now.
Do you have an outpatient psychiatrist? No
If so, what is their name?
Do you have a therapist? No
If so, what is their name?

Substance Use:
Do you use alcohol? No
If so, how many drinks per week? 
Has it ever impacted your life in a negative manner?
Have you ever had symptoms of withdrawal?
Do you use marijuana? No
If so, how much do you use per week? No 
Do you use cocaine? No
Do you use heroin? No
Do you use any other substances? No

Family History
Do you have a family history of substance use? Yes
If so, which family member and what did they struggle with? My mother drank.
Do you have a family history of suicide? No
If so, which family member? 
Do you have a family history of any psychiatric disorders? No

Social History:
Where do you live? River North
Who do you live with? Son
What do you do for work? Retired
How far did you go in school? High school
What are your hobbies? Reading history books
Are you married? No
Do you have children? One son
Have you ever been arrested? No","q_male"
"5652","
        <p>

<h2>Final Instruction</h2>

        <p><b>Thank you</b> for taking the time and working on the project! </p>
        <p>When continuing, you will be asked to download the results as a CSV file.</p>
        <p>Please <b> send us the file(s) form your annotaitons!</b> (lamparth (at) stanford.edu) </p>
        <p>
Press any key to continue and end.</p>
        ","arrowright","html-keyboard-response","24","2088461","0.0-24.0","","","","","",""
