"rt","stimulus","response","trial_type","trial_index","time_elapsed","internal_node_id","participant_name","rater_id","question_order","q_no","q","q_key"
"308889.700000003","","{""Q0"":0,""Q1"":0,""Q2"":0,""Q3"":0,""Q4"":0,""comment"":""""}","survey-slider","23","1674868","0.0-23.0","","","[1,3,0,4,2]","169","What is the best summary of the following information for a psychiatrist utilizing the information below before an initial intake: Age: 23
Name: Kristen Moore
Sexual Orientation: Straight
Gender Identity: cis-female

Chief Complaint (what brings you in): I have trauma from a sexual assault that happened two years ago.

(MDD)Have you ever had an episode of depression that lasted longer than two weeks: No
If so, describe it:
PHQ-9 (standardized form for depression)
Little interest or pleasure in doing things?
Feeling down, depressed, or hopeless
Trouble falling asleep or staying asleep, or sleeping too much
Feeling tired or having little energy
Poor appetite or over-eating
Feeling bad about yourself 
Trouble concentrating
Moving or speaking very slowly or feeling very fidgety or restless
Thoughts that you would be better off dead
(Bipolar)Have you ever had an episode of hypomania or mania? No

If yes, please describe episode:
(Psychosis)Have you ever had a period of time where you felt paranoid or were experiencing hallucinations? No
If yes, please describe:
(GAD) Have you struggled with anxiety for longer than six months? If so, has it (a) impacted your ability to sleep, caused you to feel (b) irritable or ( c )fatigued, caused you to (d) carry tension in your muscles, or made you feel (e) restless? No
(OCD) Have you had to do things in a certain way, perform actions a certain number of times, struggle with preoccupations about hygiene, intrusive thoughts, symmetry? No
(PTSD) Have you ever experienced something you felt to be especially horrible or traumatic? Yes
If yes, ask: if they are experiencing flashbacks or nightmares, if they are feeling on edge or hyper-vigilant, if they are now avoiding certain locations or activities, and if their mood has significantly worsened because of this. I have nightmares every night. I can't walk home alone at night. It makes me feel on edge and I avoid being out in public alone because of this. It has caused a negative alteration in my mood so much.

Psychiatric History:
Have you received any formal psychiatric diagnoses? PTSD
Have you ever been admitted psychiatrically? If yes, when was it and what was the reason for admission? Yes, after the assault two years ago.
Have you ever attempted suicide? No
Have you taken psychiatric medication in the past? Yes
If so, what medications have you taken? Please specify duration and dose. I am taking prazosin 5mg each night. I've taken it for two years.
Do you have an outpatient psychiatrist? No
If so, what is their name?
Do you have a therapist? Yes
If so, what is their name? Laura

Substance Use:
Do you use alcohol? Yes
If so, how many drinks per week? 5 drinks per week
Has it ever impacted your life in a negative manner? no
Have you ever had symptoms of withdrawal? no
Do you use marijuana? No
If so, how much do you use per week? 
Do you use cocaine? No
Do you use heroin? No
Do you use any other substances? No

Family History
Do you have a family history of substance use? No
If so, which family member and what did they struggle with?
Do you have a family history of suicide? No
If so, which family member?
Do you have a family history of any psychiatric disorders? No
If so, which family member and what did they struggle with?

Social History:
Where do you live? Evanston
Who do you live with? Boyfriend
What do you do for work? Chef
How far did you go in school? Undergraduate
What are your hobbies? Gardening
Are you married? No
Do you have children? No
Have you ever been arrested? No","q_male"
"8647","
        <p>

<h2>Final Instruction</h2>

        <p><b>Thank you</b> for taking the time and working on the project! </p>
        <p>When continuing, you will be asked to download the results as a CSV file.</p>
        <p>Please <b> send us the file(s) form your annotaitons!</b> (lamparth (at) stanford.edu) </p>
        <p>
Press any key to continue and end.</p>
        "," ","html-keyboard-response","24","1684521","0.0-24.0","","","","","",""
